<!ELEMENT OREG3H_kurzusfelvetel (hallgato, kurzusok)>
<!ATTLIST OREG3H_kurzusfelvetel
    tanev CDATA #REQUIRED
    egyetem CDATA #REQUIRED>

<!ELEMENT hallgato (hnev, szulev, szak)>
<!ELEMENT hnev (#PCDATA)>
<!ELEMENT szulev (#PCDATA)>
<!ELEMENT szak (#PCDATA)>

<!ELEMENT kurzusok (kurzus)+>
<!ELEMENT kurzus (kurzusnev, kredit, hely, idopont, oktato)>
<!ATTLIST kurzus
    id CDATA #REQUIRED
    jovahagyas (igen|nem) #IMPLIED
    nyelv CDATA #IMPLIED>

<!ELEMENT kurzusnev (#PCDATA)>
<!ELEMENT kredit (#PCDATA)>
<!ELEMENT hely (#PCDATA)>
<!ELEMENT idopont (#PCDATA)>
<!ELEMENT oktato (#PCDATA)>
